{
  "schema_version": "2026-05-21",
  "name": "example-api",
  "version": "1.0.0",
  "resource_identifier": "resource://api",
  "protocols": ["http/1.1", "mcp-over-http"],
  "auth_modes": ["caracal_jwt", "provider_oauth"],
  "scopes": ["read", "write"],
  "identity_forwarding": "optional_trusted_upstream",
  "required_headers": ["authorization", "traceparent", "baggage"],
  "health": {
    "path": "/healthz",
    "success_status": 200
  },
  "audit": {
    "action_result_required": true,
    "metadata_fields": ["tool_name", "provider_request_id"]
  },
  "conformance": {
    "fixture_url": "https://docs.caracal.run/schemas/caracal-gateway-upstream-manifest-2026-05-21.schema.json",
    "tested_with_caracal": "0.1.2"
  }
}
